{
  "$schema": "https://json-schema.org/draft/2020-12/schema",
  "$id": "https://openevmbench.antfleet.dev/schemas/record.schema.json",
  "title": "Open EVMBench submission record v1 (all lifecycle profiles)",
  "description": "One record shape for Detect, Patch, and Exploit (SPEC §4). The submitted profile omits state and all AntFleet-populated fields; accepted/promoted profiles add them. Profile-specific presence/absence rules beyond the state conditionals here are enforced by openevmbench.validation.",
  "type": "object",
  "required": [
    "submission_id",
    "phase",
    "mode",
    "created_at",
    "operator",
    "submission",
    "benchmark",
    "agent",
    "run",
    "score"
  ],
  "additionalProperties": false,
  "properties": {
    "submission_id": { "$ref": "#/$defs/uuid7" },
    "phase": { "enum": [1, 2, 3] },
    "mode": { "enum": ["detect", "patch", "exploit"] },
    "created_at": { "$ref": "#/$defs/rfc3339" },
    "operator": {
      "type": "object",
      "required": ["github_username", "github_id"],
      "additionalProperties": false,
      "properties": {
        "github_username": { "type": "string", "minLength": 1, "maxLength": 39 },
        "github_id": { "type": "integer", "minimum": 1 },
        "affiliation": { "type": "string" }
      }
    },
    "submission": {
      "type": "object",
      "required": ["archive_hash", "archive_size_bytes"],
      "additionalProperties": false,
      "properties": {
        "archive_hash": { "$ref": "#/$defs/sha256ref" },
        "archive_size_bytes": { "type": "integer", "minimum": 1 },
        "note_hash": { "$ref": "#/$defs/sha256ref" }
      }
    },
    "benchmark": {
      "type": "object",
      "required": ["upstream_repo", "upstream_commit", "harness_version"],
      "additionalProperties": false,
      "properties": {
        "upstream_repo": { "type": "string", "minLength": 1 },
        "upstream_commit": { "type": "string", "pattern": "^[0-9a-f]{7,40}$" },
        "harness_version": { "type": "string", "minLength": 1 }
      }
    },
    "agent": {
      "type": "object",
      "required": ["model", "scaffold_name", "scaffold_hash", "harness_kind"],
      "additionalProperties": false,
      "properties": {
        "model": { "type": "string", "minLength": 1 },
        "scaffold_name": { "type": "string", "minLength": 1 },
        "scaffold_hash": { "$ref": "#/$defs/sha256ref" },
        "harness_kind": { "enum": ["single-shot", "retry-loop", "agentic-scaffold"] }
      }
    },
    "judge": {
      "type": ["object", "null"],
      "required": ["model", "params", "prompt_hash", "transcript_hash", "transcript_contents_or_url"],
      "additionalProperties": false,
      "properties": {
        "model": { "type": "string", "minLength": 1 },
        "params": { "type": "object" },
        "prompt_hash": { "$ref": "#/$defs/sha256ref" },
        "transcript_hash": { "$ref": "#/$defs/sha256ref" },
        "transcript_contents_or_url": { "type": "string", "minLength": 1 }
      }
    },
    "run": {
      "type": "object",
      "required": ["tokens_total", "tokens_prompt", "tokens_completion", "tokens_per_task", "wall_clock_ms", "runs_count"],
      "additionalProperties": false,
      "properties": {
        "tokens_total": { "type": "integer", "minimum": 0 },
        "tokens_prompt": { "type": "integer", "minimum": 0 },
        "tokens_completion": { "type": "integer", "minimum": 0 },
        "tokens_per_task": {
          "type": "array",
          "items": { "type": ["integer", "null"], "minimum": 0 }
        },
        "wall_clock_ms": { "type": "integer", "minimum": 0 },
        "runs_count": { "type": "integer", "minimum": 1 }
      }
    },
    "score": {
      "type": "object",
      "required": ["claimed_score", "solved_count", "max_score", "per_vulnerability"],
      "additionalProperties": false,
      "properties": {
        "claimed_score": { "type": "number", "minimum": 0, "maximum": 1 },
        "official_score": { "type": "number", "minimum": 0, "maximum": 1 },
        "solved_count": { "type": "integer", "minimum": 0 },
        "max_score": { "type": "integer", "minimum": 1 },
        "per_vulnerability": {
          "type": "array",
          "minItems": 1,
          "items": {
            "type": "object",
            "required": ["vulnerability_id", "passed", "score"],
            "additionalProperties": false,
            "properties": {
              "vulnerability_id": { "type": "string", "pattern": "^[^:]+:[^:]+$" },
              "passed": { "type": "boolean" },
              "score": { "type": "integer", "enum": [0, 1] },
              "reason_code": { "type": "string" }
            }
          }
        }
      }
    },
    "state": { "enum": ["checking", "accepted", "rejected", "promoted", "yanked"] },
    "state_reason": { "type": ["string", "null"] },
    "antfleet_acceptance": {
      "type": "object",
      "required": ["signature", "acceptance_record_hash", "signed_at", "public_key_fingerprint"],
      "additionalProperties": false,
      "properties": {
        "signature": { "type": "string", "pattern": "^ed25519:[A-Za-z0-9+/]+={0,2}$" },
        "acceptance_record_hash": { "$ref": "#/$defs/sha256ref" },
        "signed_at": { "$ref": "#/$defs/rfc3339" },
        "public_key_fingerprint": { "$ref": "#/$defs/sha256ref" }
      }
    },
    "prize_review_status": { "enum": ["pending", "approved", "rejected", null] },
    "prize_review_reason": { "type": ["string", "null"] },
    "promoted_at": { "$ref": "#/$defs/rfc3339" },
    "promoted_commit_sha": { "type": "string", "pattern": "^[0-9a-f]{7,40}$" }
  },
  "allOf": [
    {
      "if": { "properties": { "mode": { "const": "detect" } } },
      "then": { "required": ["judge"], "properties": { "judge": { "type": "object" } } }
    },
    {
      "if": { "required": ["state"], "properties": { "state": { "enum": ["accepted", "promoted", "yanked"] } } },
      "then": {
        "required": ["antfleet_acceptance"],
        "properties": { "score": { "required": ["official_score"] } }
      }
    },
    {
      "if": { "required": ["state"], "properties": { "state": { "enum": ["rejected", "yanked"] } } },
      "then": {
        "required": ["state_reason"],
        "properties": { "state_reason": { "type": "string", "minLength": 1 } }
      }
    },
    {
      "if": { "required": ["state"], "properties": { "state": { "enum": ["promoted", "yanked"] } } },
      "then": { "required": ["promoted_at", "promoted_commit_sha"] }
    }
  ],
  "$defs": {
    "sha256ref": { "type": "string", "pattern": "^sha256:[0-9a-f]{64}$" },
    "uuid7": {
      "type": "string",
      "pattern": "^[0-9a-f]{8}-[0-9a-f]{4}-7[0-9a-f]{3}-[89ab][0-9a-f]{3}-[0-9a-f]{12}$"
    },
    "rfc3339": {
      "type": "string",
      "pattern": "^\\d{4}-\\d{2}-\\d{2}T\\d{2}:\\d{2}:\\d{2}(\\.\\d+)?(Z|[+-]\\d{2}:\\d{2})$"
    }
  }
}
