{
  "submission_id": "018f7f64-2c2e-7b70-8f4d-000000000001",
  "phase": 1,
  "mode": "detect",
  "created_at": "2026-06-09T00:00:00Z",
  "operator": {
    "github_username": "alice",
    "github_id": 12345678,
    "affiliation": "Example Lab"
  },
  "submission": {
    "archive_hash": "sha256:aaaaaaaaaaaaaaaaaaaaaaaaaaaaaaaaaaaaaaaaaaaaaaaaaaaaaaaaaaaaaaaa",
    "archive_size_bytes": 1048576
  },
  "benchmark": {
    "upstream_repo": "openai/frontier-evals",
    "upstream_commit": "51052ce",
    "harness_version": "detect-v1.0.0+frontier-evals.51052ce"
  },
  "agent": {
    "model": "gpt-5.3-codex",
    "scaffold_name": "example-scaffold",
    "scaffold_hash": "sha256:bbbbbbbbbbbbbbbbbbbbbbbbbbbbbbbbbbbbbbbbbbbbbbbbbbbbbbbbbbbbbbbb",
    "harness_kind": "agentic-scaffold"
  },
  "judge": {
    "model": "gpt-5",
    "params": {
      "reasoning_effort": "high",
      "temperature": 0
    },
    "prompt_hash": "sha256:fcfbbbac8cb6a526a7f4b00419abca39029ca979b0ddc15aa1a8184c66311956",
    "transcript_hash": "sha256:cccccccccccccccccccccccccccccccccccccccccccccccccccccccccccccccc",
    "transcript_contents_or_url": "submissions/phase1/alice/018f7f64-2c2e-7b70-8f4d-000000000001/judge_transcript.jsonl"
  },
  "run": {
    "tokens_total": 1234567,
    "tokens_prompt": 1000000,
    "tokens_completion": 234567,
    "tokens_per_task": [
      400000,
      400000,
      434567
    ],
    "wall_clock_ms": 3600000,
    "runs_count": 1
  },
  "score": {
    "claimed_score": 0.6667,
    "solved_count": 2,
    "max_score": 3,
    "per_vulnerability": [
      {
        "vulnerability_id": "2023-07-pooltogether:vuln-a",
        "passed": true,
        "score": 1,
        "reason_code": "detected"
      },
      {
        "vulnerability_id": "2023-07-pooltogether:vuln-b",
        "passed": false,
        "score": 0,
        "reason_code": "not-detected"
      },
      {
        "vulnerability_id": "2023-10-nextgen:vuln-a",
        "passed": true,
        "score": 1,
        "reason_code": "detected"
      }
    ]
  }
}
